section,subsection,question,answer
LLM,Inference,Triton,"Triton is an open-source framework developed by OpenAI for writing high-performance GPU code with a Python-like syntax. It simplifies writing custom GPU kernels while achieving performance comparable to handwritten CUDA code.
Triton is a language for programming GPUs.
More convenient than CUDA.
Allows writing Python-like code that compiles to PTX (Parallel Thread Execution).
PTX is the same intermediate representation used by CUDA.
Triton Compiler:
Optimizes code by rearranging it for better performance without changing its meaning.
Targets the same hardware as CUDA.
When to Use Triton
- Optimization Steps:
1. Use torch.compile():
    - Start by using torch.compile() to optimize your code.
2. Adapt Your Code:
    - Rewrite code to be more suitable for torch.compile().
        - E.g., eliminate graph breaks to enable CUDA graphs.
3. Profile and Identify Bottlenecks:
    - Find slow parts of your code using profiling tools.
    - Write custom Triton kernels for these parts.
4. Consider CUDA:
    - If still not fast enough, write custom CUDA kernels.
Rough Edges in Triton
- New-ish Project:
    - Contains rough edges; code may not behave as expected.
    - Expected to become more polished over time.
Recommendation:
    - Debugging is important; use “simulator mode” when possible.
    - Be aware of limitations on older GPUs or with certain operations.
Link: https://christianjmills.com/posts/cuda-mode-notes/lecture-014/#auto-tuning 
"
LLM,LLMOps,What is LLMOps (large language model operations)?,"LLMOps, or large language model operations, refers to the practices and processes involved in managing and operating large language models (LLMs). LLMs are artificial intelligence (AI) models trained on vast datasets of text and code, enabling them to perform various language-related tasks, such as text generation, translation, and question answering.
LLMOps involves a comprehensive set of activities, including:
Model deployment and maintenance: deploying and managing LLMs on cloud platforms or on-premises infrastructure
Data management: curating and preparing training data, as well as monitoring and maintaining data quality
Model training and fine-tuning: training and refining LLMs to improve their performance on specific tasks
Monitoring and evaluation: tracking LLM performance, identifying errors, and optimizing models
Security and compliance: ensuring the security and regulatory compliance of LLM operations
What is the difference between LLMOps and MLOps?
LLMOps is a specialized subset of MLOps (machine learning operations), which focuses specifically on the challenges and requirements of managing LLMs. While MLOps covers the general principles and practices of managing machine learning models, LLMOps addresses the unique characteristics of LLMs, such as their large size, complex training requirements, and high computational demands.
How does LLMOps work?
LLMOps involves a number of different steps, including:
Data collection and preparation: LLMs require large amounts of data to train. This data must be collected and prepared in a way that is suitable for training the model.
Model development: LLMs are developed using a variety of techniques, including unsupervised learning, supervised learning, and reinforcement learning.
Model deployment: Once a LLM has been developed, it must be deployed to a production environment. This involves setting up the necessary infrastructure and configuring the model to run on a specific platform.
Model management: LLMs require ongoing management to ensure that they are performing as expected. This includes monitoring the model's performance, retraining the model as needed, and making sure that the model is secure.
Benefits of LLMOps
LLMOps (large language model operations) offers numerous benefits for organizations looking to manage and deploy LLMs (large language models) effectively. These benefits include:
Performance
LLMOps tools and techniques help organizations optimize the performance of their LLMs by identifying and resolving bottlenecks, fine-tuning model parameters, and implementing efficient deployment strategies. This can lead to improved accuracy, faster response times, and better overall user experiences.
Scalability
LLMOps provides a scalable and flexible framework for managing LLMs, enabling organizations to easily adapt to changing demands and requirements. 
Risk reduction
LLMOps helps organizations mitigate risks associated with deploying and operating LLMs. By implementing robust monitoring systems, establishing disaster recovery plans, and conducting regular security audits, LLMOps reduces the likelihood of outages, data breaches, and other disruptions. This proactive approach minimizes the impact of potential risks and ensures the continuous availability and reliability of LLMs.
Efficiency
LLMOps streamlines the entire life cycle of LLMs, from data preparation and model training to deployment and monitoring. Automated tools and standardized processes improve efficiency by reducing manual tasks, optimizing resource utilization, and minimizing the time required for model development and deployment.
Best practices for LLMOps
LLMOps (large language model operations) best practices are a set of guidelines and recommendations that help organizations manage and deploy LLMs (large language models) effectively and efficiently. These best practices cover various aspects of the LLMOps life cycle, including data management, model training, deployment, and monitoring.
Data management
Use high-quality data: LLMs require large amounts of high-quality data to train effectively. Organizations should ensure that the data used for training is clean, accurate, and relevant to the desired use case.
Manage data efficiently: LLMs can generate vast amounts of data during training and inference. Organizations should implement efficient data management strategies, such as data compression and data partitioning, to optimize storage and retrieval.
Establish data governance: Clear data governance policies and procedures should be established to ensure the secure and responsible use of data throughout the LLMOps life cycle.
Model training
Choose the right training algorithm: Different training algorithms are suitable for different types of LLMs and tasks. Organizations should carefully evaluate the available training algorithms and select the one that best aligns with their specific requirements.
Optimize training parameters: Hyperparameter tuning is important for optimizing LLM performance. Experiment with different training parameters, such as learning rate and batch size, to find the optimal settings for your models.
Monitor training progress: Regular monitoring of training progress is essential to identify potential issues and make necessary adjustments. Organizations should implement metrics and dashboards to track key training indicators, such as loss and accuracy.
Deployment
Choose the right deployment strategy: LLMs can be deployed in various ways, such as cloud-based services, on-premises infrastructure, or edge devices. Carefully consider their specific requirements and choose the deployment strategy that best meets their needs.
Optimize deployment performance: Once deployed, LLMs should be monitored and optimized for performance. This may involve scaling resources, adjusting model parameters, or implementing caching mechanisms to improve response times.
Ensure security: Strong security measures should be implemented to protect LLMs and the data they process. This includes access controls, data encryption, and regular security audits.
Monitoring
Establish monitoring metrics: Key performance indicators (KPIs) should be established to monitor the health and performance of LLMs. These metrics may include accuracy, latency, and resource utilization.
Implement real-time monitoring: Real-time monitoring systems should be implemented to detect and respond to any issues or anomalies that may arise during operations.
Analyze monitoring data: Monitoring data should be regularly analyzed to identify trends, patterns, and potential areas for improvement. This analysis helps optimize LLMOps processes and ensure the continuous delivery of high-quality LLMs.
"
LLM,Prompting,Prompting an LLM,"You can achieve a lot with simple prompts, but the quality of results depends on how much information you provide it and how well-crafted the prompt is. A prompt can contain information like the instruction or question you are passing to the model and include other details such as context, inputs, or examples. You can use these elements to instruct the model more effectively to improve the quality of results.
Let's get started by going over a basic example of a simple prompt:
Prompt
The sky is
Output:
blue.
"
LLM,Prompting,Zero-Shot Prompting,"Large language models (LLMs) today, such as GPT-3.5 Turbo, GPT-4, and Claude 3, are tuned to follow instructions and are trained on large amounts of data. Large-scale training makes these models capable of performing some tasks in a ""zero-shot"" manner. Zero-shot prompting means that the prompt used to interact with the model won't contain examples or demonstrations. The zero-shot prompt directly instructs the model to perform a task without any additional examples to steer it.
We tried a few zero-shot examples in the previous section. Here is one of the examples (ie., text classification) we used:
Prompt:
Classify the text into neutral, negative or positive. 
Text: I think the vacation is okay.
Sentiment:
Output:
Neutral
Note that in the prompt above we didn't provide the model with any examples of text alongside their classifications, the LLM already understands ""sentiment"" -- that's the zero-shot capabilities at work.
"
LLM,Prompting,Few-Shot Prompting,"Let's demonstrate few-shot prompting via an example that was presented in Brown et al. 2020. In the example, the task is to correctly use a new word in a sentence.
Prompt:
A ""whatpu"" is a small, furry animal native to Tanzania. An example of a sentence that uses the word whatpu is:
We were traveling in Africa and we saw these very cute whatpus.
To do a ""farduddle"" means to jump up and down really fast. An example of a sentence that uses the word farduddle is:
Output:
When we won the game, we all started to farduddle in celebration.
We can observe that the model has somehow learned how to perform the task by providing it with just one example (i.e., 1-shot). For more difficult tasks, we can experiment with increasing the demonstrations (e.g., 3-shot, 5-shot, 10-shot, etc.).
Following the findings from Min et al. (2022), here are a few more tips about demonstrations/exemplars when doing few-shot:
""the label space and the distribution of the input text specified by the demonstrations are both important (regardless of whether the labels are correct for individual inputs)""
the format you use also plays a key role in performance, even if you just use random labels, this is much better than no labels at all.
additional results show that selecting random labels from a true distribution of labels (instead of a uniform distribution) also helps.
"
LLM,Prompting,Chain-of-Thought Prompting,"Introduced in Wei et al. (2022), chain-of-thought (CoT) prompting enables complex reasoning capabilities through intermediate reasoning steps. You can combine it with few-shot prompting to get better results on more complex tasks that require reasoning before responding.
Prompt:
The odd numbers in this group add up to an even number: 4, 8, 9, 15, 12, 2, 1.
A: Adding all the odd numbers (9, 15, 1) gives 25. The answer is False.
The odd numbers in this group add up to an even number: 17,  10, 19, 4, 8, 12, 24.
A: Adding all the odd numbers (17, 19) gives 36. The answer is True.
The odd numbers in this group add up to an even number: 16,  11, 14, 4, 8, 13, 24.
A: Adding all the odd numbers (11, 13) gives 24. The answer is True.
The odd numbers in this group add up to an even number: 17,  9, 10, 12, 13, 4, 2.
A: Adding all the odd numbers (17, 9, 13) gives 39. The answer is False.
The odd numbers in this group add up to an even number: 15, 32, 5, 13, 82, 7, 1. 
A:
Output:
Adding all the odd numbers (15, 5, 13, 7, 1) gives 41. The answer is False.
One recent idea that came out more recently is the idea of zero-shot CoT (Kojima et al. 2022) that essentially involves adding ""Let's think step by step"" to the original prompt.
Prompt:
I went to the market and bought 10 apples. I gave 2 apples to the neighbor and 2 to the repairman. I then went and bought 5 more apples and ate 1. How many apples did I remain with?
Let's think step by step.
Output:
First, you started with 10 apples.
You gave away 2 apples to the neighbor and 2 to the repairman, so you had 6 apples left.
Then you bought 5 more apples, so now you had 11 apples.
Finally, you ate 1 apple, so you would remain with 10 apples.
Automatic Chain-of-Thought (Auto-CoT)
When applying chain-of-thought prompting with demonstrations, the process involves hand-crafting effective and diverse examples. This manual effort could lead to suboptimal solutions. Zhang et al. (2022) propose an approach to eliminate manual efforts by leveraging LLMs with ""Let's think step by step"" prompt to generate reasoning chains for demonstrations one by one. This automatic process can still end up with mistakes in generated chains. To mitigate the effects of the mistakes, the diversity of demonstrations matter. This work proposes Auto-CoT, which samples questions with diversity and generates reasoning chains to construct the demonstrations.
Auto-CoT consists of two main stages:
Stage 1): question clustering: partition questions of a given dataset into a few clusters
Stage 2): demonstration sampling: select a representative question from each cluster and generate its reasoning chain using Zero-Shot-CoT with simple heuristics
The simple heuristics could be length of questions (e.g., 60 tokens) and number of steps in rationale (e.g., 5 reasoning steps). This encourages the model to use simple and accurate demonstrations.
"
LLM,Agents,LLM Agents,"LLM based agents, hereinafter also referred to as LLM agents for short, involve LLM applications that can execute complex tasks through the use of an architecture that combines LLMs with key modules like planning and memory. When building LLM agents, an LLM serves as the main controller or ""brain"" that controls a flow of operations needed to complete a task or user request. The LLM agent may require key modules such as planning, memory, and tool usage.
To better motivate the usefulness of an LLM agent, let's say that we were interested in building a system that can help answer the following question:
What's the average daily calorie intake for 2023 in the United States?
The question above could potentially be answered using an LLM that already has the knowledge needed to answer the question directly. If the LLM doesn't have the relevant knowledge to answer the question, it's possible to use a simple RAG system where an LLM has access to health related information or reports. Now let's give the system a more complex question like the following:
How has the trend in the average daily calorie intake among adults changed over the last decade in the United States, and what impact might this have on obesity rates? Additionally, can you provide a graphical representation of the trend in obesity rates over this period?
To answer such a question, just using an LLM alone wouldn't be enough. You can combine the LLM with an external knowledge base to form a RAG system but this is still probably not enough to answer the complex query above. This is because the complex question above requires an LLM to break the task into subparts which can be addressed using tools and a flow of operations that leads to a desired final response. A possible solution is to build an LLM agent that has access to a search API, health-related publications, and public/private health database to provide relevant information related to calorie intake and obesity.
In addition, the LLM will need access to a ""code interpreter"" tool that helps take relevant data to produce useful charts that help understand trends in obesity. These are the possible high-level components of the hypothetical LLM agent but there are still important considerations such as creating a plan to address the task and potential access to a memory module that helps the agent keep track of the state of the flow of operations, observations, and overall progress.
"
LLM,Agents,LLM Agent Framework,"Generally speaking, an LLM agent framework can consist of the following core components:
User Request - a user question or request
Agent/Brain - the agent core acting as coordinator
Planning - assists the agent in planning future actions
Memory - manages the agent's past behaviors
"
LLM,Agents,Agent,"A large language model (LLM) with general-purpose capabilities serves as the main brain, agent module, or coordinator of the system. This component will be activated using a prompt template that entails important details about how the agent will operate, and the tools it will have access to (along with tool details).
While not mandatory, an agent can be profiled or be assigned a persona to define its role. This profiling information is typically written in the prompt which can include specific details like role details, personality, social information, and other demographic information. According to [Wang et al. 2023], the strategies to define an agent profile include handcrafting, LLM-generated or data-driven.
"
LLM,Agents,Planning Without Feedback,"The planning module helps to break down the necessary steps or subtasks the agent will solve individually to answer the user request. This step is important to enable the agent to reason better about the problem and reliably find a solution. The planning module will leverage an LLM to decompose a detailed plan which will include subtasks to help address the user question. Popular techniques for task decomposition include Chain of Thought(opens in a new tab) and Tree of Thoughts(opens in a new tab) which can be categorized as single-path reasoning and multi-path reasoning, respectively. Below is a figure comparing different strategies as formalized in Wang et al., 2023(opens in a new tab):
"
LLM,Agents,Planning With Feedback,"The planning modules above don't involve any feedback which makes it challenging to achieve long-horizon planning to solve complex tasks. To address this challenge, you can leverage a mechanism that enables the model to iteratively reflect and refine the execution plan based on past actions and observations. The goal is to correct and improve on past mistakes which helps to improve the quality of final results. This is particularly important in complex real-world environments and tasks where trial and error are key to completing tasks. Two popular methods for this reflection or critic mechanism include ReAct and Reflexion.
"
LLM,Agents,ReAct,"ReAct is inspired by the synergies between ""acting"" and ""reasoning"" which allow humans to learn new tasks and make decisions or reasoning.
Chain-of-thought (CoT) prompting has shown the capabilities of LLMs to carry out reasoning traces to generate answers to questions involving arithmetic and commonsense reasoning, among other tasks (Wei et al., 2022)(opens in a new tab). But its lack of access to the external world or inability to update its knowledge can lead to issues like fact hallucination and error propagation.
ReAct is a general paradigm that combines reasoning and acting with LLMs. ReAct prompts LLMs to generate verbal reasoning traces and actions for a task. This allows the system to perform dynamic reasoning to create, maintain, and adjust plans for acting while also enabling interaction to external environments (e.g., Wikipedia) to incorporate additional information into the reasoning. The figure below shows an example of ReAct and the different steps involved to perform question answering.
"
LLM,Agents,Memory,"The memory module helps to store the agent's internal logs including past thoughts, actions, and observations from the environment, including all interactions between agent and user. There are two main memory types that have been reported in the LLM agent literature:
Short-term memory - includes context information about the agent's current situations; this is typically realized by in-context learning which means it is short and finite due to context window constraints.
Long-term memory - includes the agent's past behaviors and thoughts that need to be retained and recalled over an extended period of time; this often leverages an external vector store accessible through fast and scalable retrieval to provide relevant information for the agent as needed.
Hybrid memory integrates both short-term memory and long-term memory to improve an agent's ability for long-range reasoning and accumulation of experiences.
There are also different memory formats to consider when building agents. Representative memory formats include natural language, embeddings, databases, and structured lists, among others. These can also be combined such as in Ghost in the Minecraft (GITM(opens in a new tab)) that utilizes a key-value structure where the keys are represented by natural language and values are represented by embedding vectors.
Both the planning and memory modules allow the agent to operate in a dynamic environment and enable it to effectively recall past behaviors and plan future actions.
"
LLM,Agents,Tools,"Tools correspond to a set of tool/s that enables the LLM agent to interact with external environments such as Wikipedia Search API, Code Interpreter, and Math Engine. Tools could also include databases, knowledge bases, and external models. When the agent interacts with external tools it executes tasks via workflows that assist the agent to obtain observations or necessary information to complete subtasks and satisfy the user request. In our initial health-related query, a code interpreter is an example of a tool that executes code and generates the necessary chart information requested by the user.
"
LLM,Miscellaneous,MTP — Multi-Token Prediction,"Meta introduces a new training paradigm that alters the overall model architecture. This approach, called multi-token prediction, changes the traditional method by having the model predict several future words simultaneously instead of just one. At each position in a sentence, the model uses multiple prediction pathways, or “heads,” to forecast the next several words all at once, working collaboratively to improve efficiency and coherence.
In simple terms, we modify the LLM to predict the next four words instead of just the next one. To achieve this, we add more output heads to the model.
However, this doesn’t mean we predict 16 tokens in total. Each of the four heads produces four tokens, but we only use the first token from each head, discarding the rest (denoted as words 5, 6, 7, and 8 in the explanation).
The core idea of multi-token prediction is to train the model to predict a sequence of future words from each position in the training data, rather than just the next word. This method uses a shared underlying structure called a transformer trunk to understand the context and then employs multiple independent prediction heads to guess future words in parallel.
"
LLM,Miscellaneous,"If we trained BERT on sequences of 512 tokens, what will happen if we input text with 1024 tokens into the model?","If BERT is trained on sequences of 512 tokens, inputting 1024 tokens will exceed the model's input limit. The text will either be truncated to 512 tokens, or you might need to split the input into smaller segments and process them separately.
If truncation is enabled, the model will automatically cut off the input at the maximum token length (512 tokens). This means any tokens beyond that limit will be discarded, and only the first 512 tokens will be processed.
  Increase the model's maximum token length: You can fine-tune a version of BERT (or use a larger model like Longformer, BigBird, etc.) that supports longer sequences, such as 1024 tokens. This would allow you to process longer texts without truncation.
  Split the input into smaller chunks: If the model can’t handle longer sequences, you can break the 1024-token input into two parts (e.g., the first 512 tokens and the next 512 tokens), process them separately, and then combine the results, depending on the task.
  Use sliding window technique: This involves breaking the input into overlapping chunks (e.g., 512 tokens with a 256-token overlap) and then processing each chunk, allowing the model to capture more context across the sequence.
"
