section,subsection,question,answer
Deep Learning,Regularization,Batch Normalization during Inference,"As we discussed above, during Training, Batch Norm starts by calculating the mean and variance for a mini-batch. However, during Inference, we have a single sample, not a mini-batch. How do we obtain the mean and variance in that case?
Here is where the two Moving Average parameters come in — the ones that we calculated during training and saved with the model. We use those saved mean and variance values for the Batch Norm during Inference.
Ideally, during training, we could have calculated and saved the mean and variance for the full data. But that would be very expensive as we would have to keep values for the full dataset in memory during training. Instead, the Moving Average acts as a good proxy for the mean and variance of the data. It is much more efficient because the calculation is incremental — we have to remember only the most recent Moving Average.
"
Deep Learning,Regularization,Order of placement of Batch Norm layer,"There are two opinions for where the Batch Norm layer should be placed in the architecture — before and after activation. The original paper placed it before, although I think you will find both options frequently mentioned in the literature. Some say ‘after’ gives better results.
"
Deep Learning,Regularization,What is Layer Normalization?,"Layer Normalization was proposed by researchers Jimmy Lei Ba, Jamie Ryan Kiros, and Geoffrey E. Hinton. In layer normalization, all neurons in a particular layer effectively have the same distribution across all features for a given input.
For example, if each input has d features, it’s a d-dimensional vector. If there are B elements in a batch, the normalization is done along the length of the d-dimensional vector and not across the batch of size B.
Normalizing across all features but for each of the inputs to a specific layer removes the dependence on batches. This makes layer normalization well suited for sequence models such as transformers and recurrent neural networks (RNNs) that were popular in the pre-transformer era.
Here’s an example showing the computation of the mean and variance for layer normalization. We consider the example of a mini-batch containing three input samples, each with four features.
From these steps, we see that they’re similar to the steps we had in batch normalization. However, instead of the batch statistics, we use the mean and variance corresponding to specific input to the neurons in a particular layer, say k. This is equivalent to normalizing the output vector from the layer k-1.
"
Deep Learning,Regularization,Why do we use Conv layers without bias before Batch Normalization? ,"Batch Normalization already includes the addition of the bias term. Recap that BatchNorm is already:
gamma * normalized(x) + bias
So there is no need (and it makes no sense) to add another bias term in the convolution layer. Simply speaking BatchNorm shifts the activation by their mean values. Hence, any constant will be canceled out.
Long story short: Even if you implement the ConvWithBias+BatchNorm, it will behave like ConvWithoutBias+BatchNorm. It is the same as multiple fully-connected layers without activation function will behave like a single one.
"
Deep Learning,Regularization,Batch Normalization vs Layer Normalization,"Batch normalization normalizes each feature independently across the mini-batch. Layer normalization normalizes each of the inputs in the batch independently across all features.
As batch normalization is dependent on batch size, it’s not effective for small batch sizes. Layer normalization is independent of the batch size, so it can be applied to batches with smaller sizes as well.
Batch normalization requires different processing at training and inference times. As layer normalization is done along the length of input to a specific layer, the same set of operations can be used at both training and inference times.
Batch Normalization in Convolutional Neural Networks
Batch Norm works in a very similar way in Convolutional Neural Networks. Although we could do it in the same way as before, we have to follow the convolutional property.
In convolutions, we have shared filters that go along the feature maps of the input (in images, the feature map is generally the height and width). These filters are the same on every feature map. It is then reasonable to normalize the output, in the same way, sharing it over the feature maps.
In other words, this means that the parameters used to normalize are calculated along with each entire feature map. In a regular Batch Norm, each feature would have a different mean and standard deviation. Here, each feature map will have a single mean and standard deviation, used on all the features it contains.
"
Deep Learning,Regularization,Root Mean Square Layer Normalization,"Layer normalization (LayerNorm) has been successfully applied to various deep neural networks to help stabilize training and boost model convergence because of its capability in handling re-centering and re-scaling of both inputs and weight matrix. However, the computational overhead introduced by LayerNorm makes these improvements expensive and significantly slows the underlying network, e.g. RNN in particular. 
RMSNorm regularizes the summed inputs to a neuron in one layer according to root mean square (RMS), giving the model re-scaling invariance property and implicit learning rate adaptation ability. RMSNorm is computationally simpler and thus more efficient than LayerNorm Extensive experiments on several tasks using diverse network architectures show that RMSNorm achieves comparable performance against LayerNorm but reduces the running time by 7%∼64% on different models.
y= γ * x / sqrt(RMS[x] + ϵ)
"
Deep Learning,Segmentation,Semantic Segmentation,"Semantic segmentation is a natural step in the progression from coarse to fine inference: The origin could be located at classification, which consists of making a prediction for a whole input. The next step is localization / detection, which provide not only the classes but also additional information regarding the spatial location of those classes. Finally, semantic segmentation achieves fine-grained inference by making dense predictions inferring labels for every pixel, so that each pixel is labeled with the class of its enclosing object ore region.
"
Deep Learning,Segmentation,Metrics for Semantic Segmentation,"Let's discuss the metrics which are generally used to understand and evaluate the results of a model.
Pixel Accuracy
Pixel accuracy is the most basic metric which can be used to validate the results. Accuracy is obtained by taking the ratio of correctly classified pixels w.r.t total pixels
Accuracy = (TP+TN) / (TP+TN+FP+FN)
The main disadvantage of using such a technique is the result might look good if one class overpowers the other. Say for example the background class covers 90% of the input image we can get an accuracy of 90% by just classifying every pixel as background
Intersection Over Union
IOU is defined as the ratio of intersection of ground truth and predicted segmentation outputs over their union. If we are calculating for multiple classes, IOU of each class is calculated and their mean is taken. It is a better metric compared to pixel accuracy as if every pixel is given as background in a 2 class input the IOU value is (90/100+0/100)/2 i.e 45% IOU which gives a better representation as compared to 90% accuracy.
When using this approximation, IoU becomes differentiable and can be used as a loss function. The comparison between IoU loss and Binary Cross Entropy loss is made by testing two deep neural network models on multiple datasets and data splits.
Frequency weighted IOU
This is an extension over mean IOU which we discussed and is used to combat class imbalance. If one class dominates most part of the images in a dataset like for example background, it needs to be weighed down compared to other classes. Thus instead of taking the mean of all the class results, a weighted mean is taken based on the frequency of the class region in the dataset.
F1 Score
The metric popularly used in classification F1 Score can be used for segmentation task as well to deal with class imbalance.
Average Precision
The average precision (AP) is a way to summarize the precision-recall curve into a single value representing the average of all precisions. The AP is calculated according to the next equation. Using a loop that goes through all precisions/recalls, the difference between the current and next recalls is calculated and then multiplied by the current precision. In other words, the AP is the weighted sum of precisions at each threshold where the weight is the increase in recall.
"
Deep Learning,Segmentation,Loss functions for Semantic Segmentation,"Cross Entropy Loss
Simple average of cross-entropy classification loss for every pixel in the image can be used as an overall function. But this again suffers due to class imbalance which FCN proposes to rectify using class weights
UNet tries to improve on this by giving more weight-age to the pixels near the border which are part of the boundary as compared to inner pixels as this makes the network focus more on identifying borders and not give a coarse output.
Focal Loss
Focal loss was designed to make the network focus on hard examples by giving more weight-age and also to deal with extreme class imbalance observed in single-stage object detectors. The same can be applied in semantic segmentation tasks as well
Dice Loss
Dice function is nothing but F1 score. This loss function directly tries to optimize F1 score. Similarly direct IOU score can be used to run optimization as well
Tversky Loss
It is a variant of Dice loss which gives different weight-age to FN and FP
Boundary loss
One variant of the boundary loss is applied to tasks with highly unbalanced segmentations. This loss’s form is that of a distance metric on space contours and not regions. In this manner, it tackles the problem posed by regional losses for highly imbalanced segmentation tasks.
Hausdorff distance
It is a technique used to measure similarity between boundaries of ground truth and predicted. It is calculated by finding out the max distance from any point in one boundary to the closest point in the other. Reducing directly the boundary loss function is a recent trend and has been shown to give better results especially in use-cases like medical image segmentation where identifying the exact boundary plays a key role.
The advantage of using a boundary loss as compared to a region based loss like IOU or Dice Loss is it is unaffected by class imbalance since the entire region is not considered for optimization, only the boundary is considered.
"
Deep Learning,Segmentation,What Semantic Segmentation models do you know?,"U-Net
U-Net is a convolutional neural network originally developed for segmenting biomedical images. When visualized its architecture looks like the letter U and hence the name U-Net. Its architecture is made up of two parts, the left part – the contracting path and the right part – the expansive path. The purpose of the contracting path is to capture context while the role of the expansive path is to aid in precise localization.
The contracting path is made up of two three-by-three convolutions. The convolutions are followed by a rectified linear unit and a two-by-two max-pooling computation for downsampling.
FastFCN —Fast Fully Convolutional Network
In this architecture, a Joint Pyramid Upsampling(JPU) module is used to replace dilated convolutions since they consume a lot of memory and time. It uses a fully-connected network at its core while applying JPU for upsampling. JPU upsamples the low-resolution feature maps to high-resolution feature maps.
DeepLab
In this architecture, convolutions with upsampled filters are used for tasks that involve dense prediction. Segmentation of objects at multiple scales is done via atrous spatial pyramid pooling. Finally, DCNNs are used to improve the localization of object boundaries. Atrous convolution is achieved by upsampling the filters through the insertion of zeros or sparse sampling of 
Mask R-CNN
In this architecture, objects are classified and localized using a bounding box and semantic segmentation that classifies each pixel into a set of categories. Every region of interest gets a segmentation mask. A class label and a bounding box are produced as the final output. The architecture is an extension of the Faster R-CNN. The Faster R-CNN is made up of a deep convolutional network that proposes the regions and a detector that utilizes the regions.
"
Deep Learning,Detection,What is object detection?,"Object detection is the field of computer vision that deals with the localization and classification of objects contained in an image or video.
To put it simply: Object detection comes down to drawing bounding boxes around detected objects which allow us to locate them in a given scene (or how they move through it).
"
Deep Learning,Detection,Object detection vs image segmentation,"Image segmentation is the process of defining which pixels of an object class are found in an image. 
Semantic image segmentation will mark all pixels belonging to that tag, but won’t define the boundaries of each object.
Object detection instead will not segment the object, but will clearly define the location of each individual object instance with a box.
Combining semantic segmentation with object detection leads to instance segmentation, which first detects the object instances, and then segments each within the detected boxes (known in this case as regions of interest).
"
Deep Learning,Detection,Types and modes of object detection,"Before deep learning took off in 2013, almost all object detection was done through classical machine learning techniques. Common ones included viola-jones object detection technique, scale-invariant feature transforms (SIFT), and histogram of oriented gradients.  
These would detect a number of common features across the image, and classify their clusters using logistic regression, color histograms, or random forests. Today’s deep learning-based techniques vastly outperform these.
Deep learning-based approaches use neural network architectures like RetinaNet, YOLO (You Only Look Once), CenterNet, SSD (Single Shot Multibox detector), Region proposals (R-CNN, Fast-RCNN, Faster RCNN, Cascade R-CNN) for feature detection of the object, and then identification into labels.
Object detection generally is categorized into 2 stages:
Single-stage object detectors.
A single-stage detector removes the RoI extraction process and directly classifies and regresses the candidate anchor boxes. Examples are: YOLO family (YOLOv2, YOLOv3, YOLOv4, and YOLOv5) CornerNet, CenterNet, and others.
Two-stage object detectors.
Two-stage detectors divide the object detection task into two stages: extract RoIs (Region of interest), then classify and regress the RoIs. Examples of object detection architectures that are 2 stage oriented include R-CNN, Fast-RCNN, Faster-RCNN, Mask-RCNN and others.
"
Deep Learning,Detection,R-CNN Model Family ,"Their proposed R-CNN model is comprised of three modules; they are:
Module 1: Region Proposal. Generate and extract category independent region proposals, e.g. candidate bounding boxes.
Module 2: Feature Extractor. Extract feature from each candidate region, e.g. using a deep convolutional neural network.
Module 3: Classifier. Classify features as one of the known class, e.g. linear SVM classifier model.
The R-CNN Model family includes the following:
R-CNN—This utilizes a selective search method to locate RoIs in the input images and uses a DCN (Deep Convolutional Neural Network)-based region wise classifier to classify the RoIs independently. 
SPPNet and Fast R-CNN—This is an improved version of R-CNN that deals with the extraction of the RoIs from the feature maps. This was found to be much faster than the conventional R-CNN architecture.
Faster R-CNN—This is an improved version of Fast R-CNN that was trained end to end by introducing RPN (region proposal network). An RPN is a network utilized in generating RoIs by regressing the anchor boxes. Hence, the anchor boxes are then used in the object detection task. 
Mask R-CNN adds a mask prediction branch on the Faster R-CNN, which can detect objects and predict their masks at the same time. 
R-FCN  replaces the fully connected layers with the position-sensitive score maps for better detecting objects. 
Cascade R-CNN addresses the problem of overfitting at training and quality mismatch at inference by training a sequence of detectors with increasing IoU thresholds.
"
Deep Learning,Detection,YOLO Model Family,"The model works by first splitting the input image into a grid of cells, where each cell is responsible for predicting a bounding box if the center of a bounding box falls within the cell. Each grid cell predicts a bounding box involving the x, y coordinate and the width and height and the confidence. A class prediction is also based on each cell.
For example, an image may be divided into a 7×7 grid and each cell in the grid may predict 2 bounding boxes, resulting in 94 proposed bounding box predictions. The class probabilities map and the bounding boxes with confidences are then combined into a final set of bounding boxes and class labels. The image taken from the paper below summarizes the two outputs of the model.
The YOLO family model includes the following:
YOLO uses fewer anchor boxes (divide the input image into an S × S grid) to do regression and classification. This was built using darknet neural networks.
YOLOv2 improves the performance by using more anchor boxes and a new bounding box regression method. 
YOLOv3 is an enhanced version of the v2 variant with a deeper feature detector network and minor representational changes. YOLOv3 has relatively speedy inference times with it taking roughly 30ms per inference.
YOLOv4 (YOLOv3 upgrade) works by breaking the object detection task into two pieces, regression to identify object positioning via bounding boxes and classification to determine the object's class. YOLO V4 and its successors are technically the product of a different set of researchers than versions 1-3.
YOLOv5 is an improved version of YOLOv4 with a mosaic augmentation technique for increasing the general performance of YOLOv4.
"
Deep Learning,Detection,CenterNet,"CenterNet is a deep detection architecture that removes the need for anchors and the computationally heavy NMS. It is based on the insight that box predictions can be sorted for relevance based on the location of their centers, rather than their overlap with the object. This insight is now being used in other deep learning tasks.
The CenterNet family model includes the following:
SSD places anchor boxes densely over an input image and uses features from different convolutional layers to regress and classify the anchor boxes. 
DSSD introduces a deconvolution module into SSD to combine low level and high-level features. While R-SSD uses pooling and deconvolution operations in different feature layers to combine low-level and high-level features.
RON proposes a reverse connection and an objectness prior to extracting multiscale features effectively.
RefineDet refines the locations and sizes of the anchor boxes for two times, which inherits the merits of both one-stage and two-stage approaches. 
CornerNet is another keypoint-based approach, which directly detects an object using a pair of corners. Although CornerNet achieves high performance, it still has more room to improve.
CenterNet explores the visual patterns within each bounding box. For detecting an object, this uses a triplet, rather than a pair, of keypoints. CenterNet evaluates objects as single points by predicting the x and y coordinate of the object’s center and it’s area of coverage (width and height). It is a unique technique that has proven to out-perform variants like the SSD and R-CNN family.  
"
Deep Learning,Optimization,Neural Network Optimization,"Pruning
Quantization
Post Training Quantization: reducing the size of the weights stored (e.g. from 32-bit floating point numbers to 8-bit)
Quantization-Aware Training: There could be an accuracy loss in a post-training model quantization and to avoid this and if you don’t want to compromise the model accuracy we do quantization aware training. This technique ensures that the forward pass matches precision for both training and inference.
Low-rank approximation and sparsity 
Main idea is to approximate the redundant filters of a layer using a linear combination of fewer filters. Compressing layers in this way reduces the network’s memory footprint, the computational complexity of convolutional 	operations and can yield significant speedups. 
Examples: 
Singular Value Decomposition 
Tucker decomposition 
Canonical Polyadic decomposition
Knowledge distillation 
Trained to minimize the sum of two different cross entropy functions:
one involving the original hard labels obtained using a softmax with T=1 
one involving the softened targets, T>1
"
Deep Learning,Optimization,Pruning,"Pruning is a technique of removing unimportant parameters (weights) of a deep neural network. It aims to achieve several goals:
Reduction in storage (smaller file size)
Speed-up during inference (testing)
There are two main types of pruning techniques namely: Structured Pruning and Unstructured Pruning.
Structured Pruning
Structured pruning removes a structure (building block) of the target neural network such as:
Neuron for a Fully Connected Layer
Channel of filter for a Convolution Layer
Self-attention head for Transformer
Benefits of structured pruning:
Speed-up during inference (testing)
Trains a neural network up to certain level of performance
Prune the p% of the neurons / channels of the network
Fine-tune or retrain the pruned network for a few epochs
Repeats prune and retrain/fine-tune
Unstructured Pruning
Unstructured pruning is also called magnitude pruning. Unstructured pruning converts some of the parameters or weights with smaller magnitude into zeros.
Dense: lots of non-zero values
Sparse: lots of zeros
Unstructured pruning converts an original dense network into a sparse network. The size of the parameter matrix (or weight matrix) of the sparse network is the same as the size of parameter matrix of the original network. Sparse network has more zeros in their parameter matrix.

For unstructured pruning, adds a L1 or L2 regularization term to the loss function which penalizes non-zero parameters. During training, the regularization will push the non-zero parameters to zeros.
During pruning, set a threshold. Prune parameters with magnitude smaller than threshold, and keep parameters with magnitude larger than threshold. The pruned parameters are set to zero and frozen.
Benefits of unstructured pruning:
Reduction in storage (smaller file size)
"
Deep Learning,Optimization,Distillation of Knowledge in Neural Networks,"Knowledge distillation is used to compress a complex and large neural network into a smaller and simpler one, while still retaining the accuracy and performance of the resultant model. This process involves training a smaller neural network to mimic the behavior of a larger and more complex ""teacher"" network by learning from its predictions or internal representations.
The goal of knowledge distillation is to reduce the memory footprint and computational requirements of a model without significantly sacrificing its performance. Knowledge distillation was first introduced by Hinton et al. in 2015. Since then, the idea has gained significant attention in the research community.
In the context of knowledge distillation, the ""knowledge"" captured by the teacher network is transferred to the student network through a process of supervised learning. During this process, the student network is trained to minimize the difference between its predictions and the predictions of the teacher network on a set of training examples.
Knowledge distillation involves two main steps: training the teacher network and training the student network.
During the first step, a large and complex neural network, or the teacher network, is trained on a dataset using a standard training procedure. Once the teacher network has been trained, it is used to generate ""soft"" labels for the training data, which are probability distributions over the classes instead of binary labels. These soft labels are more informative than hard labels and capture the uncertainty and ambiguity in the predictions of the teacher network.
In the second step, a smaller neural network, or the student network, is trained on the same dataset using the soft labels generated by the teacher network. The student network is trained to minimize the difference between its own predictions and the soft labels generated by the teacher network.
The intuition behind this approach is that the soft labels contain more information about the input data and the teacher network's predictions than the hard labels. Therefore, the student network can learn to capture this additional information and generalize better to new examples.
"
