section,subsection,question,answer
Classical models,Linear Regression,What Is a Linear Regression Model? List Its Drawbacks.,"A linear regression model is a model in which there is a linear relationship between the dependent and independent variables. 
Here are the drawbacks of linear regression: 
Only the mean of the dependent variable is taken into consideration. 
It assumes that the data is independent. 
The method is sensitive to outlier data values. 
"
Classical models,Linear Regression,What are various assumptions used in linear regression? What would happen if they are violated?,"Linear regression is done under the following assumptions:
The sample data used for modeling represents the entire population.
There exists a linear relationship between the X-axis variable and the mean of the Y variable.
The residual variance is the same for any X values. This is called homoscedasticity. Residual Variance (also called unexplained variance or error variance) is the variance of any error (residual).
The errors or residuals of the data are normally distributed and independent from each other. 
There is minimal multicollinearity between explanatory variables 
Extreme violations of the above assumptions lead to redundant results. Smaller violations of these result in greater variance or bias of the estimates.
"
Classical models,Linear Regression,What methods for solving linear regression do you know?,"To solve linear regression, you need to find the coefficients which minimize the sum of squared errors.
Matrix Algebra method: Let's say you have X, a matrix of features, and y, a vector with the values you want to predict. After going through the matrix algebra and minimization problem, you get this solution:
But solving this requires you to find an inverse, which can be time-consuming, if not impossible. Luckily, there are methods like Singular Value Decomposition (SVD) or QR Decomposition that can reliably calculate this part  (called the pseudo-inverse) without actually needing to find an inverse. The popular python ML library sklearn uses SVD to solve least squares.
Alternative method: Gradient Descent. 
"
Classical models,Linear Regression,Maximum Likelihood Estimation for Linear Regression,"Linear regression can be written as a CPD in the following manner:
For linear regression we assume that μ(x) is linear and so μ(x)=βTx. We must also assume that the variance in the model is fixed (i.e. that it doesn't depend on x) and as such σ2(x)=σ2, a constant. This then implies that our parameter vector θ=(β,σ2).
In linear regression problems we need to make the assumption that the feature vectors are all independent and identically distributed (iid). This makes it far simpler to solve the log-likelihood problem, using properties of natural logarithms. Since we will be differentiating these values it is far easier to differentiate a sum than a product, hence the logarithm:
For reasons of increased computational ease, it is often easier to minimise the negative of the log-likelihood rather than maximise the log-likelihood itself. Hence, we can ""stick a minus sign in front of the log-likelihood"" to give us the negative log-likelihood (NLL):
Where RSS(β):=∑i=1N(yi−βTxi)2 is the Residual Sum of Squares, also known as the Sum of Squared Errors (SSE).
Since the first term in the equation is a constant we simply need to concern ourselves with minimising the RSS, which will be sufficient for producing the optimal parameter estimate.
To simply the notation we can write this latter term in matrix form. By defining the N×(p+1) matrix X we can write the RSS term as:
At this stage we now want to differentiate this term w.r.t. the parameter variable 

There is an extremely key assumption to make here. We need XTX to be positive-definite, which is only the case if there are more observations than there are dimensions. If this is not the case (which is extremely common in high-dimensional settings) then it is not possible to find a unique set of β coefficients and thus the following matrix equation will not hold.
Under the assumption of a positive-definite XTX we can set the differentiated equation to zero and solve for β:
The solution to this matrix equation provides 
"
Classical models,Linear Regression,Ordinary least squares,"The ordinary least squares (OLS) method can be defined as a linear regression technique that is used to estimate the unknown parameters in a model. The OLS method minimizes the sum of squared residuals (SSR), defined as the difference between the actual (observed values of the dependent variable) and the predicted values from the model. The Ordinary Least Squares (OLS) method achieves the minimization of the Sum of Squared Residuals (SSR) by optimizing the values of the coefficients in a regression model so that the total of the squares of the differences between the observed values and the values predicted by the model is as small as possible. The resulting line representing the dependent variable of the linear regression model is called the regression line. This regression line represents the best fit for the data.
The OLS method relies on several assumptions to be valid. The following is the list of key assumptions:
Linearity: There must be linear relationship between the dependent variable and the independent variables.
Independence: The observations must be independent of each other.
Homoscedasticity: The variance of the residuals should be constant across all levels of the independent variables.
Normality: The residuals / errors should be normally distributed.
No multicollinearity: The independent variables should not be highly correlated with each other.
"
Classical models,Linear Regression,Maximum a-posteriori Estimation as Regularization,"Maximum a-posteriori (MAP) method adds a prior distribution of the parameters θ:
θMAP=argmaxθp(x|y,θ)p(θ)
The optimal solution must still match the data but it has also to conform to your prior knowledge about the parameter distribution.
How is this related to adding a regularizer term to a loss function?
Instead of optimizing the posterior directly, one often optimizes negative of the logarithm instead:
θMAP=argminθ−logp(x|y,θ)p(θ)=argminθ−(logp(x|y,θ)+logp(θ))
Assuming you want the parameters θ to be normally distributed around zero, you get logp(θ)∝||θ||^2
Gaussian prior p(θ) = N(0, b^2I) is equivalent to the loss function ∥y − Φθ∥^2 + λ ∥θ∥^2, λ = σ 2/ b 2.
Minimizing the regularized least-squares loss function yields θRLS = (Φ ⊤Φ + λI) ^−1Φ ⊤ y
"
Classical models,Linear Regression,Bayesian Linear Regression,"Bayesian linear regression pushes the idea of the parameter prior a step regression further and does not even attempt to compute a point estimate of the parameters, but instead the full posterior distribution over the parameters is taken into account when making predictions. This means we do not fit any parameters, but we compute a mean over all plausible parameters settings (according to the posterior).
In Bayesian linear regression, we consider the model 
prior p(θ) = N(m0, S0),
likelihood p(y|x, θ) = N(y| ϕ ⊤ (x)θ, σ2)
where we now explicitly place a Gaussian prior on θ, which turns the parameter vector into a random variable.
In practice, we are usually not so much interested in the parameter values θ themselves. Instead, our focus often lies in the predictions we make with those parameter values. In a Bayesian setting, we take the parameter distribution and average over all plausible parameter settings when we make predictions. More specifically, to make predictions at an input x∗, we integrate out θ.
"
Classical models,Linear Regression,Your linear regression didn’t run and communicates that there are an infinite number of best estimates for the regression coefficients. What could be wrong?,"p > n.
If some of the explanatory variables are perfectly correlated (positively or negatively) then the coefficients would not be unique. 
"
Classical models,Linear Regression,What kind of regularization techniques are applicable to linear models? ,"AIC/BIC, Ridge regression, Lasso, Elastic Net, Basis pursuit denoising, Rudin–Osher–Fatemi model (TV), Potts model, RLAD, Dantzig Selector, SLOPE
"
Classical models,Linear Regression,"You have several variables that are positively correlated with your response, and you think combining all of the variables could give you a good prediction of your response. However, you see that in the multiple linear regression, one of the weights on the predictors is negative. What could be the issue?","Multicollinearity refers to a situation in which two or more explanatory variables in a multiple regression model are highly linearly related. 
Leave the model as is, despite multicollinearity. The presence of multicollinearity doesn't affect the efficiency of extrapolating the fitted model to new data provided that the predictor variables follow the same pattern of multicollinearity in the new data as in the data on which the regression model is based.
principal component regression
"
Classical models,Linear Regression,When do we need to perform feature normalization for linear models? When it’s okay not to do it? ,"Feature normalization is necessary for L1 and L2 regularizations. The idea of both methods is to penalize all the features relatively equally. This can't be done effectively if every feature is scaled differently.
Linear regression without regularization techniques can be used without feature normalization. Also, regularization can help to make the analytical solution more stable, — it adds the regularization matrix to the feature matrix before inverting it.
"
Classical models,Logistic Regression,"What are various ways to predict a binary response variable? Can you compare two of them and tell me when one would be more appropriate? What’s the difference between these? (SVM, Logistic Regression, Naive Bayes, Decision Tree, etc.)","Things to look at: N, P, linearly seperable?, features independent?, likely to overfit?, speed, performance, memory usage
Logistic Regression
features roughly linear, problem roughly linearly separable
robust to noise, use l1, l2 regularization for model selection, avoid overfitting
the output come as probabilities
efficient and the computation can be distributed
can be used as a baseline for other algorithms
(-) can hardly handle categorical features
SVM
with a nonlinear kernel, can deal with problems that are not linearly separable
(-) slow to train, for most industry scale applications, not really efficient
Naive Bayes
computationally efficient when P is large by alleviating the curse of dimensionality
works surprisingly well for some cases even if the condition doesn’t hold
with word frequencies as features, the independence assumption can be seen reasonable. So the algorithm can be used in text categorization
(-) conditional independence of every other feature should be met
Tree Ensembles
good for large N and large P, can deal with categorical features very well
non parametric, so no need to worry about outliers
GBT’s work better but the parameters are harder to tune
RF works out of the box, but usually performs worse than GBT
Deep Learning
works well for some classification tasks (e.g. image)
used to squeeze something out of the problem
"
Classical models,Logistic Regression,What is Logistic Regression?,"Logistic regression is used for binary classification where we use sigmoid function, that takes input as independent variables and produces a probability value between 0 and 1.
The logistic regression model transforms the linear regression function continuous value output into categorical value output using a sigmoid function, which maps any real-valued set of independent variables input into a value between 0 and 1. This function is known as the logistic function.
Let the independent input features be X  and the dependent variable is Y having only binary value i.e. 0 or 1, then, apply the multi-linear function to the input variables X.
z=w⋅X+b
Now we use the sigmoid function where the input will be z and we find the probability between 0 and 1. i.e. predicted y.
P(y=1)=σ(z)
P(y=0)=1−σ(z)
The odd is the ratio of something occurring to something not occurring. it is different from probability as the probability is the ratio of something occurring to everything that could possibly occur. so odd will be:
p(x)/(1−p(x)) =e^z
The final logistic regression equation will be:
p(X;b,w)=1/(1+e^(-w⋅X+b))

"
Classical models,Logistic Regression,What is the difference between odds and probability?,"The probability that an event will occur is the fraction of times you expect to see that event in many trials. Probabilities always range between 0 and 1.
The odds are defined as the probability that the event will occur divided by the probability that the event will not occur.
"
Classical models,Logistic Regression,Logistic Regression Parameter Interpretation,"log  p / 1−p  = α + β1x1 + β2x2, where x1 is binary (as before) and x2 is a continuous predictor.
e^β1 is the relative increase in the odds, going from x1 = 0 to x1 = 1 holding x2 fixed
If you increase x2 from k to k + ∆, then odds increase e^β2∆ times.
"
Classical models,Logistic Regression,Assumptions of Logistic Regression,"We will explore the assumptions of logistic regression as understanding these assumptions is important to ensure that we are using appropriate application of the model. The assumption include:
Independent observations: Each observation is independent of the other, meaning there is no correlation between any input variables.
Binary dependent variables: It takes the assumption that the dependent variable must be binary or dichotomous, meaning it can take only two values. For more than two categories SoftMax functions are used.
Linearity relationship between independent variables and log odds: The relationship between the independent variables and the log odds of the dependent variable should be linear.
No outliers: There should be no outliers in the dataset.
Large sample size: The sample size is sufficiently large
"
Classical models,Logistic Regression,What distinguishes Logistic Regression from Linear Regression?,"While Linear Regression is used to predict continuous outcomes, Logistic Regression is used to predict the likelihood of an observation falling into a specific category. Logistic Regression employs an S-shaped logistic function to map predicted values between 0 and 1.
"
Classical models,Logistic Regression,What is the effect on the coefficients of logistic regression if two predictors are highly correlated? ,"When predictor variables are correlated, the estimated regression coefficient of any one variable depends on which other predictor variables are included in the model. When predictor variables are correlated, the precision of the estimated regression coefficients decreases as more predictor variables are added to the model.
In statistics, multicollinearity (also collinearity) is a phenomenon in which two or more predictor variables in a multiple regression model are highly correlated, meaning that one can be linearly predicted from the others with a substantial degree of accuracy. In this situation the coefficient estimates of the multiple regression may change erratically in response to small changes in the model or the data. Multicollinearity does not reduce the predictive power or reliability of the model as a whole, at least within the sample data set; it only affects calculations regarding individual predictors. That is, a multiple regression model with correlated predictors can indicate how well the entire bundle of predictors predicts the outcome variable, but it may not give valid results about any individual predictor, or about which predictors are redundant with respect to others.
The consequences of multicollinearity:
Ratings estimates remain unbiased.
Standard coefficient errors increase.
The calculated t-statistics are underestimated.
Multicollinearity reduces the precision of the estimated coefficients, which weakens the statistical power of your regression model. You might not be able to trust the p-values to identify independent variables that are statistically significant.
Estimates become very sensitive to changes in specifications and changes in individual observations.
The overall quality of the equation, as well as estimates of variables not related to multicollinearity, remain unaffected.
The closer multicollinearity to perfect (strict), the more serious its consequences.
Indicators of multicollinearity:
High R2 and negligible odds.
Strong pair correlation of predictors.
Strong partial correlations of predictors.
High VIF - variance inflation factor.
"
Classical models,KNN,Nearest Neighbors Method,"The nearest neighbors method (k-Nearest Neighbors, or k-NN) is another very popular classification method that is also sometimes used in regression problems. This, like decision trees, is one of the most comprehensible approaches to classification. The underlying intuition is that you look like your neighbors. More formally, the method follows the compactness hypothesis: if the distance between the examples is measured well enough, then similar examples are much more likely to belong to the same class.

To classify each sample from the test set, one needs to perform the following operations in order:
Calculate the distance to each of the samples in the training set.
Select k samples from the training set with the minimal distance to them.
The class of the test sample will be the most frequent class among those k nearest neighbors.
"
Classical models,KNN,Nearest Neighbors Method in Real Applications,"k-NN can serve as a good starting point (baseline) in some cases;
In Kaggle competitions, k-NN is often used for the construction of meta-features (i.e. k-NN predictions as input to other models) or for stacking/blending;
The nearest neighbors method extends to other tasks like recommendation systems. The initial decision could be a recommendation of a product (or service) that is popular among the closest neighbors of the person for whom we want to make a recommendation;
In practice, on large datasets, approximate methods of search are often used for nearest neighbors. There is a number of open source libraries that implement such algorithms; check out Spotify’s library Annoy.
The quality of classification/regression with k-NN depends on several parameters:
The number of neighbors k.
The distance measure between samples (common ones include Hamming, Euclidean, cosine, and Minkowski distances). Note that most of these metrics require data to be scaled. Simply speaking, we do not want the “salary” feature, which is on the order of thousands, to affect the distance more than “age”, which is generally less than 100.
Weights of neighbors (each neighbor may contribute different weights; for example, the further the sample, the lower the weight).
"
Classical models,KNN,Pros and Cons of The nearest neighbors method,"Pros:
Simple implementation;
Well studied;
Typically, the method is a good first solution not only for classification or regression, but also recommendations;
It can be adapted to a certain problem by choosing the right metrics or kernel (in a nutshell, the kernel may set the similarity operation for complex objects such as graphs while keeping the k-NN approach the same). By the way, Alexander Dyakonov, a former top-1 kaggler, loves the simplest k-NN but with the tuned object similarity metric;
Good interpretability. There are exceptions: if the number of neighbors is large, the interpretability deteriorates (“We did not give him a loan, because he is similar to the 350 clients, of which 70 are the bad, and that is 12% higher than the average for the dataset”).
Cons:
Method considered fast in comparison with compositions of algorithms, but the number of neighbors used for classification is usually large (100-150) in real life, in which case the algorithm will not operate as fast as a decision tree.
If a dataset has many variables, it is difficult to find the right weights and to determine which features are not important for classification/regression.
Dependency on the selected distance metric between the objects. Selecting the Euclidean distance by default is often unfounded. You can find a good solution by grid searching over parameters, but this becomes very time consuming for large datasets.
There are no theoretical ways to choose the number of neighbors – only grid search (though this is often true for all hyperparameters of all models). In the case of a small number of neighbors, the method is sensitive to outliers, that is, it is inclined to overfit.
As a rule, it does not work well when there are a lot of features due to the “curse of dimensionality”. Professor Pedro Domingos, a well-known member in the ML community, talks about it here in his popular paper, “A Few Useful Things to Know about Machine Learning”; also “the curse of dimensionality” is described in the Deep Learning book in this chapter.
"
Classical models,KNN,"Which machine learning algorithm is known as the lazy learner, and why is it called so?","KNN is a Machine Learning algorithm known as a lazy learner. K-NN is a lazy learner because it doesn’t learn any machine-learned values or variables from the training data but dynamically calculates distance every time it wants to classify, hence memorizing the training dataset instead. 
"
Classical models,Decision Trees,Tree-building Algorithm,"At the heart of the popular algorithms for decision tree construction, such as ID3 or C4.5, lies the principle of greedy maximization of information gain: at each step, the algorithm chooses the variable that gives the greatest information gain upon splitting. Then the procedure is repeated recursively until the entropy is zero (or some small value to account for overfitting). Different algorithms use different heuristics for “early stopping” or “cut-off” to avoid constructing an overfitted tree.
An attribute with the highest information gain from a set should be selected as the parent (root) node.
Build child nodes for every value of attribute A.
Repeat iteratively until you finish constructing the whole tree.
"
Classical models,Decision Trees,Information Gain,"We can define information gain as a measure of how much information a feature provides about a class. Information gain helps to determine the order of attributes in the nodes of a decision tree.
The main node is referred to as the parent node, whereas sub-nodes are known as child nodes. We can use information gain to determine how good the splitting of nodes in a decision tree.
It can help us determine the quality of splitting, as we shall soon see. The calculation of information gain should help us understand this concept better.
Gain=Eparent−Echildren
The term Gain represents information gain. EparentEparent is the entropy of the parent node and E_{children} is the average entropy of the child nodes. Let’s use an example to visualize information gain and its calculation.
The more the entropy removed, the greater the information gain. The higher the information gain, the better the split.
"
Classical models,Decision Trees,Tree’s Feature Importance from Mean Decrease in Impurity (MDI),"The impurity-based feature importance ranks the numerical features to be the most important features. 
This problem stems from two limitations of impurity-based feature importances:
impurity-based importances are biased towards high cardinality features;
impurity-based importances are computed on training set statistics and therefore do not reflect the ability of feature to be useful to make predictions that generalize to the test set (when the model has enough capacity).
"
